{
  "kind": 13,
  "created_at": 1760724793,
  "pubkey": "aaaaaaaaaaaaaaaaaaaaaaaaaaaaaaaaaaaaaaaaaaaaaaaaaaaaaaaaaaaaaaaa",
  "id": "cccccccccccccccccccccccccccccccccccccccccccccccccccccccccccccccc",
  "sig": "bbbbbbbbbbbbbbbbbbbbbbbbbbbbbbbbbbbbbbbbbbbbbbbbbbbbbbbbbbbbbbbbbbbbbbbbbbbbbbbbbbbbbbbbbbbbbbbbbbbbbbbbbbbbbbbbbbbbbbbbbbbbbbbb",
  "tags": [
    [
      "a",
      "9901:aaaaaaaaaaaaaaaaaaaaaaaaaaaaaaaaaaaaaaaaaaaaaaaaaaaaaaaaaaaaaaaa:"
    ],
    [
      "e",
      "cccccccccccccccccccccccccccccccccccccccccccccccccccccccccccccccc",
      "wss://relay.example.com",
      "root"
    ]
  ],
  "content": "base64(serialized-rumor-payload)"
}